{
  "prdId": "PRD-001",
  "productName": "Client Documentation Hub",
  "version": "1.0.0",
  "status": "draft",
  "executiveSummary": "Client Documentation Hub is a secure, AI-assisted client-facing documentation portal hosted at docs.wsd.com that automatically publishes approved Confluence pages to the right clients. Internal teams continue to author in Confluence as the single source of truth; the Hub mirrors approved, tagged pages in near real-time, enforces per-client access, retains a version history, and uses AI to (a) screen content for sensitive data before publishing, (b) generate release notes and per-client change summaries, and (c) email clients when their documentation changes. The Hub replaces today's manual PDF export plus email distribution and the unscalable Confluence guest-access pattern.\n\nToday WSD authors documentation in Confluence but delivers it to clients as PDFs. Every release the docs team exports new PDFs, emails them to a contact list, and chases which version each client is reading. Confluence guest access and per-client Confluence spaces have been tried and do not scale (license cost, space sprawl, permission drift, no audit trail). The cost is concrete: support tickets against stale PDFs, hours of manual distribution per release, no auditable record of who read which version, and a split source of truth between Confluence and the latest emailed PDF.\n\nThe MVP delivers three layers in parallel: a Confluence-driven publishing pipeline (label / approval-gated, near real-time sync, immutable version history); a multi-tenant client portal with secure authentication, per-client and shared visibility, browse/search/version-history/PDF-download, and notifications; and an AI layer that screens pages for secrets and internal references before publish, generates release notes / change summaries / notification emails, and scores documentation quality. Phase 3 capabilities (in-portal AI assistant, analytics, client-impact analysis) are explicitly out of scope.\n\nThe portal targets WSD client engineers, integrators, and operators as the primary readers, WSD documentation owners as authors, and WSD release reviewers as the human gate over AI output. Success means: ≥95% reduction in manual PDF distribution, p95 sync latency under 5 minutes, ≥90% of AI-screened pages clearing first-pass review, and zero unauthorised cross-client document accesses on the audit log.",
  "problemStatement": "WSD authors documentation in Confluence but delivers it to clients as PDFs that are exported, emailed, and version-chased manually for every release. Guest Confluence access and per-client Confluence spaces have been tried and do not scale, producing stale PDFs in client hands, hours of manual distribution work per release, no auditable record of who saw which version, and a split source of truth between Confluence and the latest emailed PDF.",
  "targetUsers": [
    "Client end users (engineers, integrators, operators at WSD client companies) who read product, API, and integration documentation",
    "WSD documentation owners who author and tag pages in Confluence and approve them for publication",
    "WSD release and publishing reviewers who approve AI screening results and AI-generated release notes before they reach clients",
    "Client admins who manage which of their team members can access the client's portal account",
    "WSD security and compliance staff who consume audit logs to demonstrate access control and content review"
  ],
  "inScope": [
    "Selective sync of approved Confluence pages via configurable label / tag and space allow-list",
    "Approval-state gating: only pages flagged as approved in Confluence are eligible for publication",
    "Near real-time publishing with p95 end-to-end latency under 5 minutes from approval to portal visibility",
    "Immutable per-page version history with at least the last 20 versions retained",
    "Manual sync re-trigger and unpublish actions for doc owners, audit-logged",
    "Secure multi-tenant authentication with password + second factor, optional SAML 2.0 / OIDC SSO",
    "Per-client access scoping with shared and client-specific document visibility",
    "Client-admin role for tenant-level user lifecycle (invite, disable, remove)",
    "Audit log of authentication, document views, and admin actions, retained ≥ 12 months",
    "Browsable portal organised by product and guide category derived from Confluence labels",
    "Per-page version history view with diff against latest",
    "Per-page on-demand PDF generation of any version",
    "Full-text search scoped to the user's entitled documents",
    "Per-user 'last visited' tracking driving AI change-summary feature",
    "Email notifications on documentation changes with configurable cadence (immediate / daily / weekly)",
    "Pre-publish AI document review screening for secrets, internal URLs, Jira links, internal emails, and structurally missing content",
    "Hard block on high-severity AI findings until reviewer confirms false positive or page is corrected",
    "AI-authored release notes (What's New / Breaking Changes / Recommended Actions) with reviewer approval gate",
    "Per-client 'Since your last visit' AI change summary on the portal landing page",
    "AI-generated client notification email summaries, reviewer-approved when breaking",
    "AI documentation quality scoring (completeness / readability / missing examples / missing API responses) as soft warnings",
    "Responsive web portal accessible on modern desktop and tablet browsers"
  ],
  "outOfScope": [
    "Replacing Confluence as the authoring tool",
    "Two-way sync; portal content is read-only relative to Confluence",
    "Public (unauthenticated) documentation pages",
    "In-portal AI chat assistant ('ask the docs') — Phase 3",
    "Per-client usage analytics dashboards and client-impact analysis — Phase 3",
    "Authoring or editing documentation from inside the portal",
    "Multilingual translation of documentation; English-only first release",
    "Mobile-native applications; responsive web only",
    "Migration of historical PDF artefacts into the portal's version history",
    "Integration with non-Confluence content sources (Notion, Google Docs, GitHub markdown) for first release",
    "Quality-score trend dashboards beyond a per-page warning surface in v1"
  ],
  "objectives": [
    "Reduce manual PDF distribution emails sent by the docs team by ≥ 95% within 90 days of launch",
    "Achieve p95 sync latency under 5 minutes from Confluence approval to portal visibility (max under 15 minutes including AI review)",
    "Have ≥ 90% of AI-screened pages clear review on first pass with zero sensitive-content false negatives reaching clients",
    "Drive ≥ 60% of subscribed clients to open at least one AI change-summary email per release cycle within 90 days",
    "Maintain zero unauthorised cross-client document accesses in the security audit",
    "Reduce documentation-related support tickets attributable to stale version or missing PDF by ≥ 70% in 90 days",
    "Keep Confluence as the single source of truth — no parallel authoring surface introduced",
    "Establish auditable access and content-review records that satisfy security and compliance review without manual collation"
  ],
  "constraints": [
    "Authoring continues in the existing WSD Confluence instance; no change to the writer workflow beyond adopting the documented label / approval conventions",
    "Confluence REST API access (read + change-event subscription) is available to the sync service",
    "An approved AI provider (Claude on Anthropic API or via Bedrock; final choice in TAD) is used for review, release-notes, summary, and notification generation; provider keys are managed by platform",
    "Email delivery is via an existing transactional email provider (SES / SendGrid); the Hub does not run its own MTA",
    "Hosted under docs.wsd.com on the standard WSD container platform; specific platform choice deferred to TAD",
    "Initial client tenant provisioning is operator-driven (WSD provisions the tenant); client-admin self-service is only for end-user lifecycle, not tenant creation",
    "AI document-review pipeline must fail closed: unavailable AI provider means pages remain unpublished, never bypassed",
    "All client data in transit must use TLS 1.2 or higher; auth tokens, session cookies, and AI-pipeline payloads must be encrypted at rest",
    "Portal must meet WCAG 2.1 AA for primary client-facing reading and navigation flows",
    "Tamper-evident audit logging (append-only or signed) retained ≥ 12 months"
  ],
  "glossary": {
    "Confluence": "WSD's existing wiki / documentation authoring platform; the source of truth for all documentation content.",
    "Hub / Client Documentation Hub": "The new client-facing portal at docs.wsd.com that publishes approved Confluence pages to clients.",
    "Tenant": "An isolated logical workspace within the Hub representing one client company, with its own users and document scope.",
    "Shared document": "A document visible to all authenticated client tenants (e.g. general product documentation).",
    "Client-specific document": "A document visible only to one or more named client tenants (e.g. client-specific runbooks).",
    "Publish": "The act of pushing an approved Confluence page version through AI review and into the portal as the latest version.",
    "Approval signal": "The configurable Confluence indicator (label, page status, or workflow state) that marks a page as ready to publish.",
    "AI document review": "Pre-publish AI screening pass for secrets, internal URLs, Jira links, internal emails, and missing content.",
    "Change summary": "An AI-generated per-client 'Since your last visit' summary surfaced on the portal landing page.",
    "Release notes": "AI-generated What's New / Breaking Changes / Recommended Actions for a changed page, gated by reviewer approval.",